categoria,categoriaF,categoriaS,ciudad,ciudadF,comunidad,comunidadF,contenido,creador,discapacidad,educacion,educacionF,educacionReq,educacionReqF,educacionS,email,empresaSocial,fechaCreacion,fechaCreacionBoost,fechaCreacionPortal,fechaRevision,id,jornada,jornadaF,localizacion,minExperiencia,oReq,oferta,origen,pais,paisF,paisS,provincia,provinciaF,provinciaLimitrofe,provinciaS,salarioMax,salarioMin,score,speState,speStateId,subcategoria,subcategoriaF,subcategoriaS,telefono,tipoContratoN,titulo,trabajosOfertados,url,verMail,verTelefono,web
13,EDUCACIÓN/SERVICIOS SOCIALES,EDUCACIÓN/SERVICIOS SOCIALES,08158,El Papiol,9,CATALUÑA,"TENO PRECISA INCORPORAR PER ESCOLA DEL PAPIOL A MONITORS/ES DE MENJADOR. LES TASQUES SERAN LES PRòPIES D'UN MONITOR DE MENJADOR: EDUCAR EN HàBITS HIGIèNICS I ALIMENTARIS, DINAMITZAR EL GRUP A TRAVÉS DE JOCS I ACTIVITATS, I VETLLAR PEL GRUP D'INFANTS ASSIGNAT. HORARI DE 14:00 A 15:30 H. DATA D'INICI: INCORPORACIÓ IMMEDIATA  CONTRACTE: OBRA I SERVEI.  TIPO DE PUESTO: TEMPORAL<br> Datos de contacto: <br>CÓDIGO DE OFERTA: 092018033984 La inscripción a esta oferta se efectúa a través del portal Feina Activa (https://feinaactiva.gencat.cat/web/guest/home ), donde encontrará más información sobre los detalles del puesto de trabajo. Puede acceder a la oferta indicando la referencia (Referencia número:4357910) en la búsqueda avanzada de Feina Activa. Para optar a las ofertas de este portal, se precisa una inscripción previa en él.",NA,False,1,Sin estudios,NA,NA,Sin estudios,NA,False,2018-11-03T06:10:19Z,2018-11-03T00:00:00Z,2018-11-02T00:00:00Z,2018-11-03T22:40:29Z,1672465103,3,INDIFERENTE,"41.43823769999999,2.0099477",NA,NA,NA,SNE,724,ESPAÑA,ESPAÑA,8,BARCELONA,['BARCELONA'],BARCELONA,NA,NA,1.1720339,Activa,1,13005,EDUCACIÓN INFANTIL,EDUCACIÓN INFANTIL,NA,3,MONITORS/ES DE MENJADOR EL PAPIOL (SUPLèNCIES),1,#,NA,NA,NA
15,FÁBRICAS/INDUSTRIA,FÁBRICAS/INDUSTRIA,25120,Lleida,9,CATALUÑA,"INCORPORACIÓN DE CARÁCTER ESTABLE EN SÓLIDA EMPRESA, SECTOR METAL, UBICADA ZONA DE LLEIDA.  SE REQUIERE TÉCNICO, CONOCEDOR DE PROCESOS DE FABRICACIÓN, AYUDARÁ EN LA PREPARACIÓN Y PLANIFICACIÓN DE LA FABRICACIÓN, FACILITANDO SOPORTE AL DIRECTOR DE FÁBRICA,  - PROGRAMACIÓN CNC LÁSER, ROBOT¿ - CONTROL Y REVISIÓN LISTAS DE MATERIAS Y RECURSOS. - GENERAR Y PONER AL DÍA DOCUMENTOS TÉCNICOS OFICIALES. - GENERAR DOCUMENTOS INTERNOS PARA EL PROCESO PRODUCTIVO, ORDENES DE TRABAJO, FICHAS DE APOYO<br> Datos de contacto: <br>CÓDIGO DE OFERTA: 092018033985 La inscripción a esta oferta se efectúa a través del portal Feina Activa (https://feinaactiva.gencat.cat/web/guest/home ), donde encontrará más información sobre los detalles del puesto de trabajo. Puede acceder a la oferta indicando la referencia (Referencia número:4354853) en la búsqueda avanzada de Feina Activa. Para optar a las ofertas de este portal, se precisa una inscripción previa en él.",NA,False,1,Sin estudios,NA,NA,Sin estudios,NA,False,2018-11-03T06:10:19Z,2018-11-03T00:00:00Z,2018-11-02T00:00:00Z,2018-11-03T22:40:30Z,1672465104,3,INDIFERENTE,"41.6175899,0.6200146",NA,NA,NA,SNE,724,ESPAÑA,ESPAÑA,25,LLEIDA,['LLEIDA'],LLEIDA,NA,NA,1.1720339,Activa,1,15008,MONTADORES Y ENSAMBLADORES,MONTADORES Y ENSAMBLADORES,NA,2,TÉC. GESTIÓN EN PRODUCCIÓN IND-1427,1,#,NA,NA,NA
15,FÁBRICAS/INDUSTRIA,FÁBRICAS/INDUSTRIA,08113,Manresa,9,CATALUÑA,"A MARLEX MANRESA SELECCIONEM UN/A OPERARI/A DE PONT GRÚA AMB EXPERIèNCIA DEMOSTRABLE PER EMPRESA UBICADA AL BAGES.  - DISPOSAR DE CARNET DE PONT GRUA - DISPONIBILITAT IMMEDIATA - DISPONIBILITAT PER DESPLAçAR-SE SENSE PROBLEMES FINS AL CENTRE DE TREBALL.  S'OFEREIX: - CONTRACTE PER ETT + POSSIBILITAT D'INCORPORACIÓ PER EMPRESA - HORARI: DE 8 A 13 I DE 15 A 18 HORES<br> Datos de contacto: <br>CÓDIGO DE OFERTA: 092018033982 La inscripción a esta oferta se efectúa a través del portal Feina Activa (https://feinaactiva.gencat.cat/web/guest/home ), donde encontrará más información sobre los detalles del puesto de trabajo. Puede acceder a la oferta indicando la referencia (Referencia número:4354806) en la búsqueda avanzada de Feina Activa. Para optar a las ofertas de este portal, se precisa una inscripción previa en él.",NA,False,1,Sin estudios,NA,NA,Sin estudios,NA,False,2018-11-03T06:10:18Z,2018-11-03T00:00:00Z,2018-11-02T00:00:00Z,2018-11-03T22:40:27Z,1672465101,3,INDIFERENTE,"41.7292826,1.8225154",NA,NA,NA,SNE,724,ESPAÑA,ESPAÑA,8,BARCELONA,['BARCELONA'],BARCELONA,NA,NA,1.1720339,Activa,1,15001,ARTESANÍA/OFICIOS,ARTESANÍA/OFICIOS,NA,3,OPERADOR/A PONT GRÚA,1,#,NA,NA,NA
10,DEPENDIENTES/INFORMACIÓN,DEPENDIENTES/INFORMACIÓN,08101,L' Hospitalet de Llobregat,9,CATALUÑA,"IMPORTANTE EMPRESA DE DISTRIBUCIÓN DE JUGUETES, PUERICULTURA Y HOBBY, CON DIVERSOS PUNTOS DE VENTA EN CATALUÑA BUSCA DEPENDIENTES/AS PARA NUESTRO PUNTO DE VENTA DE GRAN VIA II.  DISPONIBILIDAD PARA TRABAJAR DE LUNES A DOMINGO EN HORARIOS DE COMERCIO. DISPONIBILIDAD PARA TRABAJAR FINES DE SEMANA Y FESTIVOS TODO EL AÑO. DISPONIBILIDAD HORARIA COMPLETA PARA CUBRIR CON TURNOS ROTATIVOS.  BUSCAMOS PERSONAS ACTIVAS, POLIVALENTES, ORIENTADAS AL CLIENTE Y CON GANAS DE PODER DESARROLLARSE PROFESIONALMENTE EN UNA EMPRESA EN CONTINUO CRECIMIENTO.  SE VALORARÁ EXPERIENCIA.<br> Datos de contacto: <br>CÓDIGO DE OFERTA: 092018033983 La inscripción a esta oferta se efectúa a través del portal Feina Activa (https://feinaactiva.gencat.cat/web/guest/home ), donde encontrará más información sobre los detalles del puesto de trabajo. Puede acceder a la oferta indicando la referencia (Referencia número:4361062) en la búsqueda avanzada de Feina Activa. Para optar a las ofertas de este portal, se precisa una inscripción previa en él.",NA,False,1,Sin estudios,NA,NA,Sin estudios,NA,False,2018-11-03T06:10:19Z,2018-11-03T00:00:00Z,2018-11-02T00:00:00Z,2018-11-03T22:40:28Z,1672465102,3,INDIFERENTE,"41.3661865,2.1164942",NA,NA,NA,SNE,724,ESPAÑA,ESPAÑA,8,BARCELONA,['BARCELONA'],BARCELONA,NA,NA,1.1720339,Activa,1,10006,CAJEROS Y TAQUILLEROS,CAJEROS Y TAQUILLEROS,NA,3,DEPENDIENTE/A GRAN VIA II,1,#,NA,NA,NA
13,EDUCACIÓN/SERVICIOS SOCIALES,EDUCACIÓN/SERVICIOS SOCIALES,08096,Granollers,9,CATALUÑA,"SUBALTERN/A PER SUBSTITUCIONS DE CURTA DURADA A CENTRES EDUCATIUS.HORARI DE TARDA. ELS REQUISITS PER OCUPAR AQUEST LLOC SÓN: TITULACIÓ D¿ESTUDIS PRIMARIS I CONEIXEMENTS DE NIVELL INTERMEDI DE LLENGUA CATALANA (B2). L¿OCUPACIÓ D¿AQUEST LLOC DE TREBALL REQUEREIX NO HAVER ESTAT CONDEMNAT/DA PER SENTèNCIA FERMA PER ALGUN DELICTE CONTRA LA LLIBERTAT I LA INDEMNITAT SEXUALS, AIXÍ COM PER TRàFIC D¿ÉSSERS HUMANS, TAL COM DISPOSA L¿ARTICLE 13.5 DE LA LLEI ORGàNICA 1/1996, DE 15 DE GENER, DE PROTECCIÓ JURÍDICA DEL MENOR, MODIFICADA PER LA LLEI 26/2015, DE 28 DE JULIOL, DE MODIFICACIÓ DEL SISTEMA DE PROTECCIÓ A LA INFàNCIA I L¿ADOLESCèNCIA.<br> Datos de contacto: <br>CÓDIGO DE OFERTA: 092018033980 La inscripción a esta oferta se efectúa a través del portal Feina Activa (https://feinaactiva.gencat.cat/web/guest/home ), donde encontrará más información sobre los detalles del puesto de trabajo. Puede acceder a la oferta indicando la referencia (Referencia número:4357934) en la búsqueda avanzada de Feina Activa. Para optar a las ofertas de este portal, se precisa una inscripción previa en él.",NA,False,2,Estudios primarios,NA,NA,Estudios primarios,NA,False,2018-11-03T06:10:18Z,2018-11-03T00:00:00Z,2018-11-02T00:00:00Z,2018-11-03T22:40:25Z,1672465099,3,INDIFERENTE,"41.60619270000001,2.2870889",NA,NA,NA,SNE,724,ESPAÑA,ESPAÑA,8,BARCELONA,['BARCELONA'],BARCELONA,NA,NA,1.1720339,Activa,1,13005,EDUCACIÓN INFANTIL,EDUCACIÓN INFANTIL,NA,3,SUBALTERN/A A CENTRES EDUCATIUS-VALLèS ORIENTAL,1,#,NA,NA,NA
08,CONDUCTORES/TRANSPORTE,CONDUCTORES/TRANSPORTE,08305,Vilafranca del Penedès,9,CATALUÑA,"EMPRESA DEDICADA AL SECTOR DE LA MENSAJERÍA SELECCIONA UN MENSAJERO REPARTIDOR CON VEHÍCULO PROPIO PARA SU DELEGACIÓN EN VILAFRANCA.<br> Datos de contacto: <br>CÓDIGO DE OFERTA: 092018033981 La inscripción a esta oferta se efectúa a través del portal Feina Activa (https://feinaactiva.gencat.cat/web/guest/home ), donde encontrará más información sobre los detalles del puesto de trabajo. Puede acceder a la oferta indicando la referencia (Referencia número:4354841) en la búsqueda avanzada de Feina Activa. Para optar a las ofertas de este portal, se precisa una inscripción previa en él.",NA,False,1,Sin estudios,NA,NA,Sin estudios,NA,False,2018-11-03T06:10:18Z,2018-11-03T00:00:00Z,2018-11-02T00:00:00Z,2018-11-03T22:40:26Z,1672465100,3,INDIFERENTE,"41.3461265,1.6979398",NA,NA,NA,SNE,724,ESPAÑA,ESPAÑA,8,BARCELONA,['BARCELONA'],BARCELONA,NA,NA,1.1720339,Activa,1,08003,REPARTO DE MERCANCÍAS,REPARTO DE MERCANCÍAS,NA,4,MENSAJERO REPARTIDOR,1,#,NA,NA,NA
13,EDUCACIÓN/SERVICIOS SOCIALES,EDUCACIÓN/SERVICIOS SOCIALES,17186,Sarrià de Ter,9,CATALUÑA,"ACADèMIA D'ANGLèS DE NOVA OBERTURA DE SARRIà DE TER CERCA 1 PROFESSOR/A D'ANGLèS PEL CURS 2018-2019. - HORARI DE TARDES MAJORITàRIAMENT. - NECESSARI TENIR NIVELL ADVANCED (C1) PER FER CLASSE PER NIVELL FIRST CERTIFICATE. - INICI NOVEMBRE.<br> Datos de contacto: <br>CÓDIGO DE OFERTA: 092018033978 La inscripción a esta oferta se efectúa a través del portal Feina Activa (https://feinaactiva.gencat.cat/web/guest/home ), donde encontrará más información sobre los detalles del puesto de trabajo. Puede acceder a la oferta indicando la referencia (Referencia número:4354856) en la búsqueda avanzada de Feina Activa. Para optar a las ofertas de este portal, se precisa una inscripción previa en él.",NA,False,4,Bachillerato,NA,NA,Bachillerato,NA,False,2018-11-03T06:10:17Z,2018-11-03T00:00:00Z,2018-11-02T00:00:00Z,2018-11-03T22:40:24Z,1672465097,3,INDIFERENTE,"42.0127092,2.8147556",NA,NA,NA,SNE,724,ESPAÑA,ESPAÑA,17,GIRONA,['GIRONA'],GIRONA,NA,NA,1.1720339,Activa,1,13009,OTRAS ACTIVIDADES,OTRAS ACTIVIDADES,NA,3,PROFESSOR/A ANGLèS,1,#,NA,NA,NA
13,EDUCACIÓN/SERVICIOS SOCIALES,EDUCACIÓN/SERVICIOS SOCIALES,08148,Olivella,9,CATALUÑA,"TENO PRECISA INCORPORAR A MONITORS/ES PER FER SUPLèNCIES EN DIFENRETS ESCOLES DE LA ZONA D'OLIVELLA. LES TASQUES SERAN LES PRòPIES D'UN MONITOR DE MENJADOR: EDUCAR EN HàBITS HIGIèNICS I ALIMENTARIS, DINAMITZAR EL GRUP A TRAVÉS DE JOCS I ACTIVITATS, I VETLLAR PEL GRUP D'INFANTS ASSIGNAT. HORARI PARCIAL DE 12,30 A 15 H. APROX. SOU SEGONS CONVENI DEL LLEURE.<br> Datos de contacto: <br>CÓDIGO DE OFERTA: 092018033979 La inscripción a esta oferta se efectúa a través del portal Feina Activa (https://feinaactiva.gencat.cat/web/guest/home ), donde encontrará más información sobre los detalles del puesto de trabajo. Puede acceder a la oferta indicando la referencia (Referencia número:4361060) en la búsqueda avanzada de Feina Activa. Para optar a las ofertas de este portal, se precisa una inscripción previa en él.",NA,False,1,Sin estudios,NA,NA,Sin estudios,NA,False,2018-11-03T06:10:17Z,2018-11-03T00:00:00Z,2018-11-02T00:00:00Z,2018-11-03T22:40:25Z,1672465098,3,INDIFERENTE,"41.3102463,1.8114185",NA,NA,NA,SNE,724,ESPAÑA,ESPAÑA,8,BARCELONA,['BARCELONA'],BARCELONA,NA,NA,1.1720339,Activa,1,13005,EDUCACIÓN INFANTIL,EDUCACIÓN INFANTIL,NA,3,MONITORS/ES MENJADOR OLIVELLA (SUPLèNCIES),1,#,NA,NA,NA
01,ADMINISTRACIÓN,ADMINISTRACIÓN,08096,Granollers,9,CATALUÑA,"EMPRESA NACIONAL, FABRICANTE DE EQUIPOS E INSTALACIONES PARA EL TRATAMIENTO DE AGUAS RESIDUALES, CON PRESENCIA A NIVEL MUNDIAL, NECESITA INCORPORAR PARA SUS INSTALACIONES DE LES FRANQUESES DEL VALLES:  ADMINISTRATIVO/VA COMERCIAL CON INGLÉS PARA SU DEPARTAMENTO DE EXPORTACIÓN   EN DEPENDENCIA DEL DIRECTOR COMERCIAL LAS TAREAS A REALIZAR SERÁN:  -PREPARACIÓN, ENVÍO Y SEGUIMIENTO DE OFERTAS COMERCIALES PARA LOS CLIENTES INTERNACIONALES -MANTENIMIENTO Y FIDELIZACIÓN DE LA CARTERA DE CLIENTES YA EXISTENTES  -BÚSQUEDA DE NUEVOS CLIENTES -TAREAS ADMINISTRATIVAS DIVERSAS RELACIONADAS CON EL ÁREA DE COMERCIAL  SE OFRECE ESTABILIDAD LABORAL Y CONTINUIDAD EN EL PUESTO DE TRABAJO, E INCORPORACIÓN A EQUIPO DE PROFESIONALES TOTALMENTE CONSOLIDADO. HORARIO : 09.00H A 14.30H ¿ 16.00H A 18.45H  SALARIO:1700 ? BRUTOS/MES X 12 PAGAS  TIPO DE CONTRATO : 6 MESES + 6 MESES + INDEFINIDO   IMPRESCINDIBLE  -EXPERIENCIA ANTERIOR EN DEPARTAMENTO DE VENTAS INTERNACIONALES -FORMACIÓN TÉCNICA - (...)<br> Datos de contacto: <br>CÓDIGO DE OFERTA: 092018033976 La inscripción a esta oferta se efectúa a través del portal Feina Activa (https://feinaactiva.gencat.cat/web/guest/home ), donde encontrará más información sobre los detalles del puesto de trabajo. Puede acceder a la oferta indicando la referencia (Referencia número:4357888) en la búsqueda avanzada de Feina Activa. Para optar a las ofertas de este portal, se precisa una inscripción previa en él.",NA,False,1,Sin estudios,NA,NA,Sin estudios,NA,False,2018-11-03T06:10:17Z,2018-11-03T00:00:00Z,2018-11-02T00:00:00Z,2018-11-03T22:40:22Z,1672465095,3,INDIFERENTE,"41.60619270000001,2.2870889",NA,NA,NA,SNE,724,ESPAÑA,ESPAÑA,8,BARCELONA,['BARCELONA'],BARCELONA,NA,NA,1.1720339,Activa,1,01001,ADMINISTRATIVOS,ADMINISTRATIVOS,NA,2,ADMINISTRATIVO/A COMERCIAL CON INGLÉS,1,#,NA,NA,NA
20,METAL/MECÁNICA,METAL/MECÁNICA,08073,Cornellà de Llobregat,9,CATALUÑA,"ES BUSCA PERSONAL AMB EL TITOL DE MANTENIDOR PER REPARAR I FER REFORMES EN APARELLS ELEVADORS<br> Datos de contacto: <br>CÓDIGO DE OFERTA: 092018033977 La inscripción a esta oferta se efectúa a través del portal Feina Activa (https://feinaactiva.gencat.cat/web/guest/home ), donde encontrará más información sobre los detalles del puesto de trabajo. Puede acceder a la oferta indicando la referencia (Referencia número:4354810) en la búsqueda avanzada de Feina Activa. Para optar a las ofertas de este portal, se precisa una inscripción previa en él.",NA,False,5,"FP I, Ciclo de Grado Medio",NA,NA,"FP I, Ciclo de Grado Medio",NA,False,2018-11-03T06:10:17Z,2018-11-03T00:00:00Z,2018-11-02T00:00:00Z,2018-11-03T22:40:22Z,1672465096,3,INDIFERENTE,"41.3573827,2.0707159",NA,NA,NA,SNE,724,ESPAÑA,ESPAÑA,8,BARCELONA,['BARCELONA'],BARCELONA,NA,NA,1.1720339,Activa,1,20003,MECÁNICA/MANTENIMIENTO,MECÁNICA/MANTENIMIENTO,NA,3,TECNIC DE MONTATJE,1,#,NA,NA,NA
13,EDUCACIÓN/SERVICIOS SOCIALES,EDUCACIÓN/SERVICIOS SOCIALES,17184,Santa Pau,9,CATALUÑA,"LA PERSONA S'INCORPORARà EN UN PROJECTE SOCIAL I LA SEVA MISSIÓ SERÁ LA PROSPECCIÓ D'EMPRESES I LA COORDINACIÓ DE PROGRAMES D'INSERCIÓ A L'EMPRESA ORDINàRIA DE COL.LECTIUS VULNERABLES.<br> Datos de contacto: <br>CÓDIGO DE OFERTA: 092018033975 La inscripción a esta oferta se efectúa a través del portal Feina Activa (https://feinaactiva.gencat.cat/web/guest/home ), donde encontrará más información sobre los detalles del puesto de trabajo. Puede acceder a la oferta indicando la referencia (Referencia número:4354804) en la búsqueda avanzada de Feina Activa. Para optar a las ofertas de este portal, se precisa una inscripción previa en él.",NA,False,1,Sin estudios,NA,NA,Sin estudios,NA,False,2018-11-03T06:10:16Z,2018-11-03T00:00:00Z,2018-11-02T00:00:00Z,2018-11-03T22:40:20Z,1672465094,3,INDIFERENTE,"42.1471882,2.5703053",NA,NA,NA,SNE,724,ESPAÑA,ESPAÑA,17,GIRONA,['GIRONA'],GIRONA,NA,NA,1.1720339,Activa,1,13002,ASISTENCIA E INTEGRACIÓN SOCIAL,ASISTENCIA E INTEGRACIÓN SOCIAL,NA,2,RESPONSABLE INSERCIO,1,#,NA,NA,NA
18,INGENIERÍA/CALIDAD/CIENCIAS,INGENIERÍA/CALIDAD/CIENCIAS,08019,Barcelona,9,CATALUÑA,"DESDE JOBANDTALENT SELECCIONAMOS A REPARTIDORES CON CARNET C+CAP+TACÓGRAFO PARA UNA EMPRESA DE REPARTOS DE AGUA PARA SUS NAVES EN PAPIOL O MARTORELLES (BARCELONA).  *TAREAS A REALIZAR:*  SE RESPONSABILIZARÁN DE PROPORCIONAR EL SERVICIO DE ATENCIÓN AL CLIENTE Y REPARTO DEL PRODUCTO (BOTELLAS DE 20 LITROS DE AGUA, CAFÉ, MINIS, VASOS) Y EL MANTENIMIENTO DE LOS DISPENSADORES DENTRO DEL PLAZO ESTABLECIDO, BRINDANDO UNA ADECUADA ATENCIÓN A LOS/LAS CLIENTES/AS, ASESORÁNDOLES EN EL FUNCIONAMIENTO Y USO CORRECTO DEL PRODUCTO.  *REQUISITOS* ¿	ESTAR EN POSESIÓN DEL CARNET C ¿	MUY VALORABLE CAP+TACÓGRAFO ¿	HABILIDADES DE COMUNICACIÓN, CAPACIDAD DE ESCUCHA. ¿	VALORABLE ENTRE 6 MESES Y 1 AÑO DE EXPERIENCIA COMO  REPARTIDOR Y/O ATENCIÓN AL CLIENTE.   *CONDICIONES:* ¿	CONTRATO 3 MESES ETT + INCORPORACIÓN A PLANTILLA ¿	HORARIO L-V DE 7-17H (1H PARA COMER) ¿	SALARIO 1706 ?/BRUTOS MENSUALES ¿	BENEFICIOS SOCIALES: TICKETS RESTAURANTE Y FISIOTERAPÉUTA<br> Datos de contacto: <br>CÓDIGO DE OFERTA: 092018033974 La inscripción a esta oferta se efectúa a través del portal Feina Activa (https://feinaactiva.gencat.cat/web/guest/home ), donde encontrará más información sobre los detalles del puesto de trabajo. Puede acceder a la oferta indicando la referencia (Referencia número:4357890) en la búsqueda avanzada de Feina Activa. Para optar a las ofertas de este portal, se precisa una inscripción previa en él.",NA,False,1,Sin estudios,NA,NA,Sin estudios,NA,False,2018-11-03T06:10:16Z,2018-11-03T00:00:00Z,2018-11-02T00:00:00Z,2018-11-03T22:40:19Z,1672465093,3,INDIFERENTE,"41.3850639,2.1734035",NA,NA,NA,SNE,724,ESPAÑA,ESPAÑA,8,BARCELONA,['BARCELONA'],BARCELONA,NA,NA,1.1720339,Activa,1,18003,INGENIERÍAS,INGENIERÍAS,NA,2,REPARTIDORES CARNET C+CAP+TACÓGRAFO,1,#,NA,NA,NA
09,CONSTRUCCIÓN,CONSTRUCCIÓN,08187,Sabadell,9,CATALUÑA,"SOM UNA EMPRESA AMB 50 ANYS D'EXPERIèNCIA EN EL SECTOR DEL GASOS COMBUSTIBLES. REALITZEM TOT TIPUS D'INSTAL·LACIONS, PROJECTES, MUNTATGES I MANTENIMENTS, I ENS AVALA UNA PLANTILLA MOLT CONSOLIDADA QUE ENS APORTA VALOR VERS LA NOSTRA COMPETèNCIA. PER LA PROVÍNCIA DE BARCELONA BUSQUEM UN/A INSTAL·LADOR/A DE GAS QUE ENS ACOMPANYI EN AQUEST CAMÍ, QUE VAM COMENçAR MOLT ANYS ENRERE, PER ESDEVENIR UNA EMPRESA LIDER EN EL SEU SECTOR, COMPROMESA AMB LA RETENCIÓ DEL SEU CAPITAL HUMà I EL CREIXEMENT PROFESSIONAL I PERSONAL DELS SEUS TREBALLADORS.<br> Datos de contacto: <br>CÓDIGO DE OFERTA: 092018033973 La inscripción a esta oferta se efectúa a través del portal Feina Activa (https://feinaactiva.gencat.cat/web/guest/home ), donde encontrará más información sobre los detalles del puesto de trabajo. Puede acceder a la oferta indicando la referencia (Referencia número:4361065) en la búsqueda avanzada de Feina Activa. Para optar a las ofertas de este portal, se precisa una inscripción previa en él.",NA,False,1,Sin estudios,NA,NA,Sin estudios,NA,False,2018-11-03T06:10:16Z,2018-11-03T00:00:00Z,2018-11-02T00:00:00Z,2018-11-03T22:40:18Z,1672465092,3,INDIFERENTE,"41.5462745,2.1086131",NA,NA,NA,SNE,724,ESPAÑA,ESPAÑA,8,BARCELONA,['BARCELONA'],BARCELONA,NA,NA,1.1720339,Activa,1,09005,FONTANERÍA,FONTANERÍA,NA,2,INSTAL·LADOR/A DE GAS,1,#,NA,NA,NA
12,DIRECTIVOS,DIRECTIVOS,17015,Banyoles,9,CATALUÑA,"ENTITAT DEL PLA DE L'ESTANY BUSCA UNA PERSONA PER AL SEU DEPARTAMENT DE COMUNICACIÓ.<br> Datos de contacto: <br>CÓDIGO DE OFERTA: 092018033972 La inscripción a esta oferta se efectúa a través del portal Feina Activa (https://feinaactiva.gencat.cat/web/guest/home ), donde encontrará más información sobre los detalles del puesto de trabajo. Puede acceder a la oferta indicando la referencia (Referencia número:4357879) en la búsqueda avanzada de Feina Activa. Para optar a las ofertas de este portal, se precisa una inscripción previa en él.",NA,False,1,Sin estudios,NA,NA,Sin estudios,NA,False,2018-11-03T06:10:15Z,2018-11-03T00:00:00Z,2018-11-02T00:00:00Z,2018-11-03T22:40:17Z,1672465091,3,INDIFERENTE,"42.1181833,2.7651488",NA,NA,NA,SNE,724,ESPAÑA,ESPAÑA,17,GIRONA,['GIRONA'],GIRONA,NA,NA,1.1720339,Activa,1,12001,AREA DIRECTIVA,AREA DIRECTIVA,NA,2,GESTIÓ COMUNICACIÓ - XARXES SOCIALS (SOM-BANYOLES),1,#,NA,NA,NA
18,INGENIERÍA/CALIDAD/CIENCIAS,INGENIERÍA/CALIDAD/CIENCIAS,43047,Constantí,9,CATALUÑA,"DESDE JOBANDTALENT SELECCIONAMOS A REPARTIDORES CON CARNET C+CAP+TACÓGRAFO PARA UNA EMPRESA DE REPARTOS DE AGUA PARA SU NAVE EN TARRAGONA.  *TAREAS A REALIZAR:*  SE RESPONSABILIZARÁN DE PROPORCIONAR EL SERVICIO DE ATENCIÓN AL CLIENTE Y REPARTO DEL PRODUCTO (BOTELLAS DE 20 LITROS DE AGUA, CAFÉ, MINIS, VASOS) Y EL MANTENIMIENTO DE LOS DISPENSADORES DENTRO DEL PLAZO ESTABLECIDO, BRINDANDO UNA ADECUADA ATENCIÓN A LOS/LAS CLIENTES/AS, ASESORÁNDOLES EN EL FUNCIONAMIENTO Y USO CORRECTO DEL PRODUCTO.  *REQUISITOS* ¿	ESTAR EN POSESIÓN DEL CARNET C ¿	MUY VALORABLE CAP+TACÓGRAFO ¿	HABILIDADES DE COMUNICACIÓN, CAPACIDAD DE ESCUCHA. ¿	VALORABLE ENTRE 6 MESES Y 1 AÑO DE EXPERIENCIA COMO  REPARTIDOR Y/O ATENCIÓN AL CLIENTE.   *CONDICIONES:* ¿	CONTRATO 3 MESES ETT + INCORPORACIÓN A PLANTILLA ¿	HORARIO L-V DE 7-17H (1H PARA COMER) ¿	SALARIO 1226,71 ?/BRUTOS MENSUALES ¿	BENEFICIOS SOCIALES: TICKETS RESTAURANTE Y FISIOTERAPÉUTA<br> Datos de contacto: <br>CÓDIGO DE OFERTA: 092018033971 La inscripción a esta oferta se efectúa a través del portal Feina Activa (https://feinaactiva.gencat.cat/web/guest/home ), donde encontrará más información sobre los detalles del puesto de trabajo. Puede acceder a la oferta indicando la referencia (Referencia número:4357943) en la búsqueda avanzada de Feina Activa. Para optar a las ofertas de este portal, se precisa una inscripción previa en él.",NA,False,1,Sin estudios,NA,NA,Sin estudios,NA,False,2018-11-03T06:10:15Z,2018-11-03T00:00:00Z,2018-11-02T00:00:00Z,2018-11-03T22:40:17Z,1672465090,3,INDIFERENTE,"41.1535458,1.212596",NA,NA,NA,SNE,724,ESPAÑA,ESPAÑA,43,TARRAGONA,['TARRAGONA'],TARRAGONA,NA,NA,1.1720339,Activa,1,18003,INGENIERÍAS,INGENIERÍAS,NA,2,REPARTIDORES CARNET C+CAP+TACÓGRAFO,1,#,NA,NA,NA
15,FÁBRICAS/INDUSTRIA,FÁBRICAS/INDUSTRIA,08184,Rubí,9,CATALUÑA,"EMPRESA UBICADA EN RUBÍ PRECISA INCORPORAR PULIDOR/A DE ACERO INOXIDABLE.  SE REQUIERE EXPERIENCIA PREVIA.  HORARIO: 06.00 A 14.00H.  SALARIO SEGÚN CONVENIO (APROX. 12? BRUTOS/HORA).<br> Datos de contacto: <br>CÓDIGO DE OFERTA: 092018033970 La inscripción a esta oferta se efectúa a través del portal Feina Activa (https://feinaactiva.gencat.cat/web/guest/home ), donde encontrará más información sobre los detalles del puesto de trabajo. Puede acceder a la oferta indicando la referencia (Referencia número:4357922) en la búsqueda avanzada de Feina Activa. Para optar a las ofertas de este portal, se precisa una inscripción previa en él.",NA,False,1,Sin estudios,NA,NA,Sin estudios,NA,False,2018-11-03T06:10:15Z,2018-11-03T00:00:00Z,2018-11-02T00:00:00Z,2018-11-03T22:40:15Z,1672465089,3,INDIFERENTE,"41.4971174,2.0349243",NA,NA,NA,SNE,724,ESPAÑA,ESPAÑA,8,BARCELONA,['BARCELONA'],BARCELONA,NA,NA,1.1720339,Activa,1,15001,ARTESANÍA/OFICIOS,ARTESANÍA/OFICIOS,NA,3,PULIDOR/A ACERO INOXIDABLE,1,#,NA,NA,NA
09,CONSTRUCCIÓN,CONSTRUCCIÓN,25008,Albesa,9,CATALUÑA,"FABRICACIÓ I COL.LOCACIÓ DE FINESTRES, PORTES, MOBLES, FALS SOSTRES, ESCALES . . .<br> Datos de contacto: <br>CÓDIGO DE OFERTA: 092018033969 La inscripción a esta oferta se efectúa a través del portal Feina Activa (https://feinaactiva.gencat.cat/web/guest/home ), donde encontrará más información sobre los detalles del puesto de trabajo. Puede acceder a la oferta indicando la referencia (Referencia número:4341818) en la búsqueda avanzada de Feina Activa. Para optar a las ofertas de este portal, se precisa una inscripción previa en él.",NA,False,2,Estudios primarios,NA,NA,Estudios primarios,NA,False,2018-11-03T06:10:15Z,2018-11-03T00:00:00Z,2018-11-02T00:00:00Z,2018-11-03T22:40:15Z,1672465088,3,INDIFERENTE,"41.752541,0.6595183999999999",NA,NA,NA,SNE,724,ESPAÑA,ESPAÑA,25,LLEIDA,['LLEIDA'],LLEIDA,NA,NA,1.1720339,Activa,1,09002,CARPINTERÍA,CARPINTERÍA,NA,2,FUSTER OFICIAL DE 1ª,1,#,NA,NA,NA
09,CONSTRUCCIÓN,CONSTRUCCIÓN,08019,Barcelona,9,CATALUÑA,"PRESTIGIOSA PROMOTORA INMOBILIARIA, CON MÁS DE 10 AÑOS DE EXPERIENCIA EN EN LA COMPRA, REHABILITACIÓN / CONSTRUCCIÓN Y VENTA DE EDIFICIOS Y VIVIENDAS CON ENCANTO EN BARCELONA Y MADRID, PRECISA INCORPORAR DIRECTOR DE OBRAS PARA LOS NÚCLEOS DE BARCELONA Y MADRID. CONDICIONES DE CONTRATACIÓN: CONTRATACIÓN INDEFINIDA. INTEGRACIÓN A COMPAÑÍA DE PRESTIGIO EN EL SECTOR Y EN UN GRAN MOMENTO DE EXPANSIÓN. RETRIBUCIÓN: A NEGOCIAR CON EL PROFESIONAL INCORPORADO, INCLUYENDO POTENTE FIJO + ATRACTIVOS INCENTIVOS.<br> Datos de contacto: <br>CÓDIGO DE OFERTA: 092018033968 La inscripción a esta oferta se efectúa a través del portal Feina Activa (https://feinaactiva.gencat.cat/web/guest/home ), donde encontrará más información sobre los detalles del puesto de trabajo. Puede acceder a la oferta indicando la referencia (Referencia número:4357900) en la búsqueda avanzada de Feina Activa. Para optar a las ofertas de este portal, se precisa una inscripción previa en él.",NA,False,1,Sin estudios,NA,NA,Sin estudios,NA,False,2018-11-03T06:10:14Z,2018-11-03T00:00:00Z,2018-11-02T00:00:00Z,2018-11-03T22:40:13Z,1672465087,3,INDIFERENTE,"41.3850639,2.1734035",NA,NA,NA,SNE,724,ESPAÑA,ESPAÑA,8,BARCELONA,['BARCELONA'],BARCELONA,NA,NA,1.1720339,Activa,1,09003,ENCARGADOS DE OBRAS/CAPATACES,ENCARGADOS DE OBRAS/CAPATACES,NA,2,DIRECTOR DE OBRAS EN PROMOTORA INMOBILIARIA,1,#,NA,NA,NA
