categoria,categoriaF,categoriaS,ciudad,ciudadF,comunidad,comunidadF,contenido,creador,discapacidad,educacion,educacionF,educacionReq,educacionReqF,educacionS,email,empresaSocial,fechaCreacion,fechaCreacionBoost,fechaCreacionPortal,fechaRevision,id,jornada,jornadaF,localizacion,minExperiencia,oReq,oferta,origen,pais,paisF,paisS,provincia,provinciaF,provinciaLimitrofe,provinciaS,salarioMax,salarioMin,score,speState,speStateId,subcategoria,subcategoriaF,subcategoriaS,telefono,tipoContratoN,titulo,trabajosOfertados,url,verMail,verTelefono,web
10,DEPENDIENTES/INFORMACIÓN,DEPENDIENTES/INFORMACIÓN,08113,Manresa,9,CATALUÑA,"ROGES SUPERMERCATS, CADENA DE SUPERMERCATS DEDICADA AL SECTOR DE L'ALIMENTACIÓ (SPAR), NECESSITA COBRIR UN LLOC DE TREBALL. EL CANDIDAT HAURà D'ESTAR DISPOSAT A PRESTAR ELS SEUS SERVEIS INDISTINTAMENT EN QUALSEVOL DELS CENTRES QUE LA EMPRESA DISPOSA A LA COMARCA DEL BAGES, PER TANT ES INDISPENSABLE DISPOSAR DE CARNET I VEHICLE PROPI, AIXÍ COM DISPONIBILITAT HORARIA.<br> Datos de contacto: <br>CÓDIGO DE OFERTA: 092018033825 La inscripción a esta oferta se efectúa a través del portal Feina Activa (https://feinaactiva.gencat.cat/web/guest/home ), donde encontrará más información sobre los detalles del puesto de trabajo. Puede acceder a la oferta indicando la referencia (Referencia número:4357961) en la búsqueda avanzada de Feina Activa. Para optar a las ofertas de este portal, se precisa una inscripción previa en él.",NA,False,3,"ESO, EGB, Graduado Escolar",NA,NA,"ESO, EGB, Graduado Escolar",NA,False,2018-11-03T06:09:31Z,2018-11-03T00:00:00Z,2018-11-02T00:00:00Z,2018-11-03T22:38:00Z,1672464943,3,INDIFERENTE,"41.7292826,1.8225154",NA,NA,NA,SNE,724,ESPAÑA,ESPAÑA,8,BARCELONA,['BARCELONA'],BARCELONA,NA,NA,1.1720339,Activa,1,10006,CAJEROS Y TAQUILLEROS,CAJEROS Y TAQUILLEROS,NA,3,CAIXER-A/REPONEDOR-A -MANRESA,1,#,NA,NA,NA
13,EDUCACIÓN/SERVICIOS SOCIALES,EDUCACIÓN/SERVICIOS SOCIALES,08019,Barcelona,9,CATALUÑA,"EXECUCIÓ DE TASQUES DE SUPORT ADMINISTRATIU ALS EQUIPS D'ATENCIÓ I INFORMACIÓ DE LA UNIVERSITAT. INDISPENSABLE EXPERIèNCIA EN TASQUES ADMINISTRATIVES I CONEIXEMENTS DE LLENGUA ANGLESA A NIVELL AVANçAT (B2-MCER) AMB FLUïDESA ORAL. INCORPORACIÓ IMMEDIATA, DURADA PREVISTA INICIAL D'1 A 2 MESOS. RETRIBUCIÓ BRUTA MENSUAL: 1.512?. JORNADA COMPLETA EN HORARI CONTINUAT DE TARDA (DE 14H A 9.30H, FLEXIBILITAT: 13-14H I 9.30-22H). UBICACIÓ: BARCELONA<br> Datos de contacto: <br>CÓDIGO DE OFERTA: 092018033824 La inscripción a esta oferta se efectúa a través del portal Feina Activa (https://feinaactiva.gencat.cat/web/guest/home ), donde encontrará más información sobre los detalles del puesto de trabajo. Puede acceder a la oferta indicando la referencia (Referencia número:4361536) en la búsqueda avanzada de Feina Activa. Para optar a las ofertas de este portal, se precisa una inscripción previa en él.",NA,False,4,Bachillerato,NA,NA,Bachillerato,NA,False,2018-11-03T06:09:31Z,2018-11-03T00:00:00Z,2018-11-02T00:00:00Z,2018-11-03T22:37:59Z,1672464942,3,INDIFERENTE,"41.3850639,2.1734035",NA,NA,NA,SNE,724,ESPAÑA,ESPAÑA,8,BARCELONA,['BARCELONA'],BARCELONA,NA,NA,1.1720339,Activa,1,13005,EDUCACIÓN INFANTIL,EDUCACIÓN INFANTIL,NA,3,AUXILIAR ADMINISTRATIU TARDA (ANGLèS AVANçAT),1,#,NA,NA,NA
18,INGENIERÍA/CALIDAD/CIENCIAS,INGENIERÍA/CALIDAD/CIENCIAS,08073,Cornellà de Llobregat,9,CATALUÑA,"IMPORTANTE EMPRESA DE MENSAJERÍA UBICADA EN CORNELLà DEL LLOBREGAT PRECISA UN/A JEFE DE TRÁFICO PARA SU DEPARTAMENTO DE TRÁFICO.<br> Datos de contacto: <br>CÓDIGO DE OFERTA: 092018033815 La inscripción a esta oferta se efectúa a través del portal Feina Activa (https://feinaactiva.gencat.cat/web/guest/home ), donde encontrará más información sobre los detalles del puesto de trabajo. Puede acceder a la oferta indicando la referencia (Referencia número:4354838) en la búsqueda avanzada de Feina Activa. Para optar a las ofertas de este portal, se precisa una inscripción previa en él.",NA,False,5,"FP I, Ciclo de Grado Medio",NA,NA,"FP I, Ciclo de Grado Medio",NA,False,2018-11-03T06:09:28Z,2018-11-03T00:00:00Z,2018-11-02T00:00:00Z,2018-11-03T22:37:51Z,1672464933,3,INDIFERENTE,"41.3573827,2.0707159",NA,NA,NA,SNE,724,ESPAÑA,ESPAÑA,8,BARCELONA,['BARCELONA'],BARCELONA,NA,NA,1.1720339,Activa,1,18003,INGENIERÍAS,INGENIERÍAS,NA,2,JEFE DE TRÁFICO,1,#,NA,NA,NA
19,CUIDADOS/ASISTENCIA EN EL HOGAR,CUIDADOS/ASISTENCIA EN EL HOGAR,08211,Sant Feliu de Llobregat,9,CATALUÑA,"ASSESSORAR A NIVELL DIETÈTIC AL CLIENT. ES REQUEREIX TITULACIÓ EN : TÈCNIC SUPERIOR EN DIETÈTICA, DIPLOMAT EN DIETÈTICA/INFERMERIA, LLLICENCIAT EN BIOLOGIA/BIOQUIMICA/CIÈNCIA I TECNOLOGIA D'ALIMENTS.<br> Datos de contacto: <br>CÓDIGO DE OFERTA: 092018033814 La inscripción a esta oferta se efectúa a través del portal Feina Activa (https://feinaactiva.gencat.cat/web/guest/home ), donde encontrará más información sobre los detalles del puesto de trabajo. Puede acceder a la oferta indicando la referencia (Referencia número:4357914) en la búsqueda avanzada de Feina Activa. Para optar a las ofertas de este portal, se precisa una inscripción previa en él.",NA,False,6,"FP II, Ciclo de Grado Superior",NA,NA,"FP II, Ciclo de Grado Superior",NA,False,2018-11-03T06:09:28Z,2018-11-03T00:00:00Z,2018-11-02T00:00:00Z,2018-11-03T22:37:50Z,1672464932,3,INDIFERENTE,"41.38467,2.0494619",NA,NA,NA,SNE,724,ESPAÑA,ESPAÑA,8,BARCELONA,['BARCELONA'],BARCELONA,NA,NA,1.1720339,Activa,1,19005,SERVICIO DOMÉSTICO,SERVICIO DOMÉSTICO,NA,3,ASSESSOR DIETÈTIC - SANT FELIU DE LLOBREGAT,1,#,NA,NA,NA
06,COMERCIAL/VENTAS,COMERCIAL/VENTAS,08019,Barcelona,9,CATALUÑA,"COMERCIAL DE VENTAS<br> Datos de contacto: <br>CÓDIGO DE OFERTA: 092018033813 La inscripción a esta oferta se efectúa a través del portal Feina Activa (https://feinaactiva.gencat.cat/web/guest/home ), donde encontrará más información sobre los detalles del puesto de trabajo. Puede acceder a la oferta indicando la referencia (Referencia número:4344978) en la búsqueda avanzada de Feina Activa. Para optar a las ofertas de este portal, se precisa una inscripción previa en él.",NA,False,1,Sin estudios,NA,NA,Sin estudios,NA,False,2018-11-03T06:09:27Z,2018-11-03T00:00:00Z,2018-11-02T00:00:00Z,2018-11-03T22:37:49Z,1672464931,3,INDIFERENTE,"41.3850639,2.1734035",NA,NA,NA,SNE,724,ESPAÑA,ESPAÑA,8,BARCELONA,['BARCELONA'],BARCELONA,NA,NA,1.1720339,Activa,1,06001,AGENTES COMERCIALES/REPRESENTANTES,AGENTES COMERCIALES/REPRESENTANTES,NA,2,COMERCIAL VENTA,1,#,NA,NA,NA
18,INGENIERÍA/CALIDAD/CIENCIAS,INGENIERÍA/CALIDAD/CIENCIAS,25120,Lleida,9,CATALUÑA,"EMPRESA AMB MÉS DE 60 ANYS D¿EXPERIèNCIA EN ELS TRANSFORMATS METàL·LICS,  PRECISA INCORPORAR UN/A TèCNIC/A DE CONTROL DE COSTOS PER TAL D¿ANALITZAR, SUPERVISAR I FER SEGUIMENT DE COSTOS.<br> Datos de contacto: <br>CÓDIGO DE OFERTA: 092018033812 La inscripción a esta oferta se efectúa a través del portal Feina Activa (https://feinaactiva.gencat.cat/web/guest/home ), donde encontrará más información sobre los detalles del puesto de trabajo. Puede acceder a la oferta indicando la referencia (Referencia número:4361032) en la búsqueda avanzada de Feina Activa. Para optar a las ofertas de este portal, se precisa una inscripción previa en él.",NA,False,1,Sin estudios,NA,NA,Sin estudios,NA,False,2018-11-03T06:09:27Z,2018-11-03T00:00:00Z,2018-11-02T00:00:00Z,2018-11-03T22:37:48Z,1672464930,3,INDIFERENTE,"41.6175899,0.6200146",NA,NA,NA,SNE,724,ESPAÑA,ESPAÑA,25,LLEIDA,['LLEIDA'],LLEIDA,NA,NA,1.1720339,Activa,1,18003,INGENIERÍAS,INGENIERÍAS,NA,2,TèCNIC/A DE CONTROL DE COSTOS,1,#,NA,NA,NA
01,ADMINISTRACIÓN,ADMINISTRACIÓN,08019,Barcelona,9,CATALUÑA,"NECESSITEM INCORPORAR UN/A ADMINISTRATIU/VA SUC'S (SECTOR FTTH)<br> Datos de contacto: <br>CÓDIGO DE OFERTA: 092018033819 La inscripción a esta oferta se efectúa a través del portal Feina Activa (https://feinaactiva.gencat.cat/web/guest/home ), donde encontrará más información sobre los detalles del puesto de trabajo. Puede acceder a la oferta indicando la referencia (Referencia número:4357953) en la búsqueda avanzada de Feina Activa. Para optar a las ofertas de este portal, se precisa una inscripción previa en él.",NA,False,5,"FP I, Ciclo de Grado Medio",NA,NA,"FP I, Ciclo de Grado Medio",NA,False,2018-11-03T06:09:29Z,2018-11-03T00:00:00Z,2018-11-02T00:00:00Z,2018-11-03T22:37:54Z,1672464937,3,INDIFERENTE,"41.3850639,2.1734035",NA,NA,NA,SNE,724,ESPAÑA,ESPAÑA,8,BARCELONA,['BARCELONA'],BARCELONA,NA,NA,1.1720339,Activa,1,01001,ADMINISTRATIVOS,ADMINISTRATIVOS,NA,3,ADMINISTRATIU/VA SUC'S,1,#,NA,NA,NA
14,ELECTRICIDAD/ELECTRÓNICA/ENERGÍA,ELECTRICIDAD/ELECTRÓNICA/ENERGÍA,08266,Cerdanyola del Vallès,9,CATALUÑA,"MONTAR GRUPOS MECÁNICOS SEGÚN PLANO, INCLUYENDO ESTRUCTURAS, BANCADAS, CILINDROS, RODAMIENTOS, REDUCTORES, ETC. SOLDADURA, MECANIZADO, ETC.<br> Datos de contacto: <br>CÓDIGO DE OFERTA: 092018033818 La inscripción a esta oferta se efectúa a través del portal Feina Activa (https://feinaactiva.gencat.cat/web/guest/home ), donde encontrará más información sobre los detalles del puesto de trabajo. Puede acceder a la oferta indicando la referencia (Referencia número:4361045) en la búsqueda avanzada de Feina Activa. Para optar a las ofertas de este portal, se precisa una inscripción previa en él.",NA,False,5,"FP I, Ciclo de Grado Medio",NA,NA,"FP I, Ciclo de Grado Medio",NA,False,2018-11-03T06:09:29Z,2018-11-03T00:00:00Z,2018-11-02T00:00:00Z,2018-11-03T22:37:53Z,1672464936,3,INDIFERENTE,"41.4900419,2.1396748",NA,NA,NA,SNE,724,ESPAÑA,ESPAÑA,8,BARCELONA,['BARCELONA'],BARCELONA,NA,NA,1.1720339,Activa,1,14001,ELECTRICIDAD,ELECTRICIDAD,NA,2,MONTADOR AJUSTADOR DE MAQUINARIA INDUSTRIAL,1,#,NA,NA,NA
11,DERECHO/PSICOLOGÍA/CIENCIAS SOCIALES,DERECHO/PSICOLOGÍA/CIENCIAS SOCIALES,08101,L' Hospitalet de Llobregat,9,CATALUÑA,"ENTITAT DEL TERCER SECTOR, QUE TREBALLA PER LES PERSONES AMB DISCAPACITAT I ALTRE COL·LECTIUS EN RISC, CERCA UN/A PSICòLEG/A PER REALITZAR LA DIRECCIÓ TèCNICA I RESPONSABILITZAR-SE DEL FUNCIONAMENT, PLANIFICACIÓ I SUPERVISIÓ DE LES ACTIVITATS D'UN CENTRE OCUPACIONAL SITUAT A CORNELLà. ES CERCA UN PSICòLEG/A AMB EXPERIèNCIA EN LA GESTIÓ I/O DIRECCIÓ DE SERVEIS SOCIALS, EXPERIèNCIA EN LA GESTIÓ D'EQUIPS MULTIDISCIPLINARIS I ES VALORARà EXPERIèNCIA AMB EL COL·LECTIU DE DISCAPACITAT INTEL·LECTUAL.<br> Datos de contacto: <br>CÓDIGO DE OFERTA: 092018033817 La inscripción a esta oferta se efectúa a través del portal Feina Activa (https://feinaactiva.gencat.cat/web/guest/home ), donde encontrará más información sobre los detalles del puesto de trabajo. Puede acceder a la oferta indicando la referencia (Referencia número:4357891) en la búsqueda avanzada de Feina Activa. Para optar a las ofertas de este portal, se precisa una inscripción previa en él.",NA,False,8,Licenciado o Ingeniero Superior,NA,NA,Licenciado o Ingeniero Superior,NA,False,2018-11-03T06:09:29Z,2018-11-03T00:00:00Z,2018-11-02T00:00:00Z,2018-11-03T22:37:52Z,1672464935,3,INDIFERENTE,"41.3661865,2.1164942",NA,NA,NA,SNE,724,ESPAÑA,ESPAÑA,8,BARCELONA,['BARCELONA'],BARCELONA,NA,NA,1.1720339,Activa,1,11003,PSICÓLOGOS,PSICÓLOGOS,NA,3,DIRECTOR/A TèCNIC/A CENTRE OCUPACIONAL,1,#,NA,NA,NA
15,FÁBRICAS/INDUSTRIA,FÁBRICAS/INDUSTRIA,08267,Sentmenat,9,CATALUÑA,"PROGRAMACIÓ DE PLC, AUTòMATES I ROBòTICA INDUSTRIAL<br> Datos de contacto: <br>CÓDIGO DE OFERTA: 092018033816 La inscripción a esta oferta se efectúa a través del portal Feina Activa (https://feinaactiva.gencat.cat/web/guest/home ), donde encontrará más información sobre los detalles del puesto de trabajo. Puede acceder a la oferta indicando la referencia (Referencia número:4357944) en la búsqueda avanzada de Feina Activa. Para optar a las ofertas de este portal, se precisa una inscripción previa en él.",NA,False,1,Sin estudios,NA,NA,Sin estudios,NA,False,2018-11-03T06:09:28Z,2018-11-03T00:00:00Z,2018-11-02T00:00:00Z,2018-11-03T22:37:51Z,1672464934,3,INDIFERENTE,"41.6130052,2.1359861",NA,NA,NA,SNE,724,ESPAÑA,ESPAÑA,8,BARCELONA,['BARCELONA'],BARCELONA,NA,NA,1.1720339,Activa,1,15008,MONTADORES Y ENSAMBLADORES,MONTADORES Y ENSAMBLADORES,NA,2,PROGRAMADOR DE MAQUINARIA,1,#,NA,NA,NA
15,FÁBRICAS/INDUSTRIA,FÁBRICAS/INDUSTRIA,17079,Girona,9,CATALUÑA,"CERQUEM INSTAL·LADORS PER A LES NOSTRES EMPRESES ASSOCIADES. ISNTAL·LADORS D'ELECTRICITAT, CALEFACCIÓ, AIRE CONDICIONAT, FRED INDUSTRIAL, GAS, TELECOMUNICACIONS, ENERGIES ALTERNATIVES, ETC.<br> Datos de contacto: <br>CÓDIGO DE OFERTA: 092018033836 La inscripción a esta oferta se efectúa a través del portal Feina Activa (https://feinaactiva.gencat.cat/web/guest/home ), donde encontrará más información sobre los detalles del puesto de trabajo. Puede acceder a la oferta indicando la referencia (Referencia número:4357967) en la búsqueda avanzada de Feina Activa. Para optar a las ofertas de este portal, se precisa una inscripción previa en él.",NA,False,1,Sin estudios,NA,NA,Sin estudios,NA,False,2018-11-03T06:09:34Z,2018-11-03T00:00:00Z,2018-11-02T00:00:00Z,2018-11-03T22:38:10Z,1672464954,3,INDIFERENTE,"41.9794005,2.8214264",NA,NA,NA,SNE,724,ESPAÑA,ESPAÑA,17,GIRONA,['GIRONA'],GIRONA,NA,NA,1.1720339,Activa,1,15001,ARTESANÍA/OFICIOS,ARTESANÍA/OFICIOS,NA,2,INSTAL·LADORS PER A TOTES LES COMARQUES,1,#,NA,NA,NA
18,INGENIERÍA/CALIDAD/CIENCIAS,INGENIERÍA/CALIDAD/CIENCIAS,08113,Manresa,9,CATALUÑA,"IMPRESSOR/A DIGITAL GRAN FORMAT<br> Datos de contacto: <br>CÓDIGO DE OFERTA: 092018033837 La inscripción a esta oferta se efectúa a través del portal Feina Activa (https://feinaactiva.gencat.cat/web/guest/home ), donde encontrará más información sobre los detalles del puesto de trabajo. Puede acceder a la oferta indicando la referencia (Referencia número:4354808) en la búsqueda avanzada de Feina Activa. Para optar a las ofertas de este portal, se precisa una inscripción previa en él.",NA,False,1,Sin estudios,NA,NA,Sin estudios,NA,False,2018-11-03T06:09:35Z,2018-11-03T00:00:00Z,2018-11-02T00:00:00Z,2018-11-03T22:38:11Z,1672464955,3,INDIFERENTE,"41.7292826,1.8225154",NA,NA,NA,SNE,724,ESPAÑA,ESPAÑA,8,BARCELONA,['BARCELONA'],BARCELONA,NA,NA,1.1720339,Activa,1,18006,OTRAS ACTIVIDADES TÉCNICAS,OTRAS ACTIVIDADES TÉCNICAS,NA,2,IMPRESSOR/A DIGITAL GRAN FORMAT,1,#,NA,NA,NA
01,ADMINISTRACIÓN,ADMINISTRACIÓN,43014,Amposta,9,CATALUÑA,"IMPORTANT EMPRESA DE LA COMARCA DEL MONTSIà CERCA AUXILIAR ADMINISTRATIU/VA.<br> Datos de contacto: <br>CÓDIGO DE OFERTA: 092018033838 La inscripción a esta oferta se efectúa a través del portal Feina Activa (https://feinaactiva.gencat.cat/web/guest/home ), donde encontrará más información sobre los detalles del puesto de trabajo. Puede acceder a la oferta indicando la referencia (Referencia número:4357936) en la búsqueda avanzada de Feina Activa. Para optar a las ofertas de este portal, se precisa una inscripción previa en él.",NA,False,1,Sin estudios,NA,NA,Sin estudios,NA,False,2018-11-03T06:09:35Z,2018-11-03T00:00:00Z,2018-11-02T00:00:00Z,2018-11-03T22:38:12Z,1672464956,3,INDIFERENTE,"40.7067997,0.5801695",NA,NA,NA,SNE,724,ESPAÑA,ESPAÑA,43,TARRAGONA,['TARRAGONA'],TARRAGONA,NA,NA,1.1720339,Activa,1,01001,ADMINISTRATIVOS,ADMINISTRATIVOS,NA,3,AUXILIAR ADMINISTRATIU/VA,1,#,NA,NA,NA
10,DEPENDIENTES/INFORMACIÓN,DEPENDIENTES/INFORMACIÓN,08019,Barcelona,9,CATALUÑA,"DEPENDIENTE-A CHARCUTERIA (BARCELONA CAPITAL)<br> Datos de contacto: <br>CÓDIGO DE OFERTA: 092018033839 La inscripción a esta oferta se efectúa a través del portal Feina Activa (https://feinaactiva.gencat.cat/web/guest/home ), donde encontrará más información sobre los detalles del puesto de trabajo. Puede acceder a la oferta indicando la referencia (Referencia número:4357959) en la búsqueda avanzada de Feina Activa. Para optar a las ofertas de este portal, se precisa una inscripción previa en él.",NA,False,2,Estudios primarios,NA,NA,Estudios primarios,NA,False,2018-11-03T06:09:35Z,2018-11-03T00:00:00Z,2018-11-02T00:00:00Z,2018-11-03T22:38:13Z,1672464957,3,INDIFERENTE,"41.3850639,2.1734035",NA,NA,NA,SNE,724,ESPAÑA,ESPAÑA,8,BARCELONA,['BARCELONA'],BARCELONA,NA,NA,1.1720339,Activa,1,10006,CAJEROS Y TAQUILLEROS,CAJEROS Y TAQUILLEROS,NA,2,DEPENDIENTE-A CHARCUTERIA (BARCELONA CAPITAL),1,#,NA,NA,NA
18,INGENIERÍA/CALIDAD/CIENCIAS,INGENIERÍA/CALIDAD/CIENCIAS,08113,Manresa,9,CATALUÑA,"PREIMPRESSOR/A -  MAQUINISTA IMPRESSOR/A PER MANRESA<br> Datos de contacto: <br>CÓDIGO DE OFERTA: 092018033840 La inscripción a esta oferta se efectúa a través del portal Feina Activa (https://feinaactiva.gencat.cat/web/guest/home ), donde encontrará más información sobre los detalles del puesto de trabajo. Puede acceder a la oferta indicando la referencia (Referencia número:4354787) en la búsqueda avanzada de Feina Activa. Para optar a las ofertas de este portal, se precisa una inscripción previa en él.",NA,False,1,Sin estudios,NA,NA,Sin estudios,NA,False,2018-11-03T06:09:36Z,2018-11-03T00:00:00Z,2018-11-02T00:00:00Z,2018-11-03T22:38:14Z,1672464958,3,INDIFERENTE,"41.7292826,1.8225154",NA,NA,NA,SNE,724,ESPAÑA,ESPAÑA,8,BARCELONA,['BARCELONA'],BARCELONA,NA,NA,1.1720339,Activa,1,18006,OTRAS ACTIVIDADES TÉCNICAS,OTRAS ACTIVIDADES TÉCNICAS,NA,2,PREIMPRESSOR/A -  MAQUINISTA IMPRESSOR/A,1,#,NA,NA,NA
10,DEPENDIENTES/INFORMACIÓN,DEPENDIENTES/INFORMACIÓN,08019,Barcelona,9,CATALUÑA,"PERSONA ENCARREGADA DE REBRE O EMETRE TRUCADES TELEFòNIQUES DELS NOSTRES DIFERENTS CLIENTS, EN CATALà, CASTELLà O ANGLèS,  OFERINT LA INFORMACIÓ ADIENT EN CADA CAS, SEGONS EL PROTOCOL TELEFòNIC ESTABLERT AMB ANTERIORITAT AMB CADA EMPRESA (MULTISERVEI), I HAVENT REBUT ABANS LA FORMACIÓ NECESSàRIA. FIDELITZAR CLIENTS. ATENCIÓ DE LES QUEIXES, SUGGERIMENTS I RECLAMACIONS. INFORMAR, RESOLDRE DUBTES, INCIDèNCIES I OFERIR SUPORT DELS CLIENTS, DELS DIFERENTS SERVEIS O PRODUCTES QUE OFEREIXEN LES EMPRESES PER LES QUALS TREBALLEM. ASSESSORAR SOBRE INCIDèNCIES COMPLEXES QUE NO PODEN SER RESOLTES DE MANERA AUTOMàTICA. SEGUIMENT DE LES INCIDèNCIES PER COMPROVAR SI S'HAN SOLUCIONAT. CONCERTACIÓ DE VISITES, AGENDES MèDIQUES I ALTRES SERVEIS QUE OFERIM A LES EMPRESES.<br> Datos de contacto: <br>CÓDIGO DE OFERTA: 092018033841 La inscripción a esta oferta se efectúa a través del portal Feina Activa (https://feinaactiva.gencat.cat/web/guest/home ), donde encontrará más información sobre los detalles del puesto de trabajo. Puede acceder a la oferta indicando la referencia (Referencia número:4354800) en la búsqueda avanzada de Feina Activa. Para optar a las ofertas de este portal, se precisa una inscripción previa en él.",NA,False,5,"FP I, Ciclo de Grado Medio",NA,NA,"FP I, Ciclo de Grado Medio",NA,False,2018-11-03T06:09:36Z,2018-11-03T00:00:00Z,2018-11-02T00:00:00Z,2018-11-03T22:38:15Z,1672464959,3,INDIFERENTE,"41.3850639,2.1734035",NA,NA,NA,SNE,724,ESPAÑA,ESPAÑA,8,BARCELONA,['BARCELONA'],BARCELONA,NA,NA,1.1720339,Activa,1,10003,INFORMACIÓN/AZAFATAS/PROMOCIÓN COMERCIAL,INFORMACIÓN/AZAFATAS/PROMOCIÓN COMERCIAL,NA,3,TELEOPERADOR,1,#,NA,NA,NA
19,CUIDADOS/ASISTENCIA EN EL HOGAR,CUIDADOS/ASISTENCIA EN EL HOGAR,43031,Les Borges del Camp,9,CATALUÑA,"COBRIR VACANTS, SUPLèNCIES, ... DE CUINA I NETEJA.<br> Datos de contacto: <br>CÓDIGO DE OFERTA: 092018033843 La inscripción a esta oferta se efectúa a través del portal Feina Activa (https://feinaactiva.gencat.cat/web/guest/home ), donde encontrará más información sobre los detalles del puesto de trabajo. Puede acceder a la oferta indicando la referencia (Referencia número:4357963) en la búsqueda avanzada de Feina Activa. Para optar a las ofertas de este portal, se precisa una inscripción previa en él.",NA,False,2,Estudios primarios,NA,NA,Estudios primarios,NA,False,2018-11-03T06:09:36Z,2018-11-03T00:00:00Z,2018-11-02T00:00:00Z,2018-11-03T22:38:17Z,1672464961,3,INDIFERENTE,"41.1702125,1.0209204",NA,NA,NA,SNE,724,ESPAÑA,ESPAÑA,43,TARRAGONA,['TARRAGONA'],TARRAGONA,NA,NA,1.1720339,Activa,1,19005,SERVICIO DOMÉSTICO,SERVICIO DOMÉSTICO,NA,3,AUXILIAR DE CUINA I NETEJA,1,#,NA,NA,NA
16,HOSTELERÍA/TURISMO,HOSTELERÍA/TURISMO,08019,Barcelona,9,CATALUÑA,"TENO CATERING PRECISA INCORPORAR A AUXILIARS DE CUINA PER TREBALLAR EN RESIDENCIES I ESCOLES DE BARCELONA PROVINCIA.  LES FUNCIONS SERAN SUPORT A LA PREPARACIÓ DELS MENÚS PELS USUARIS I NETEJA DELS UTENSILIS I CUINA. HORARIS DE DILLUNS A DIUMENGES (MATÍ I TARDA) EN RESIDENCIES I DE DILLUNS A DIVENDRES AL MATÍ EN ESCOLES. SOU SEGONS CONVENI.<br> Datos de contacto: <br>CÓDIGO DE OFERTA: 092018033842 La inscripción a esta oferta se efectúa a través del portal Feina Activa (https://feinaactiva.gencat.cat/web/guest/home ), donde encontrará más información sobre los detalles del puesto de trabajo. Puede acceder a la oferta indicando la referencia (Referencia número:4361059) en la búsqueda avanzada de Feina Activa. Para optar a las ofertas de este portal, se precisa una inscripción previa en él.",NA,False,1,Sin estudios,NA,NA,Sin estudios,NA,False,2018-11-03T06:09:36Z,2018-11-03T00:00:00Z,2018-11-02T00:00:00Z,2018-11-03T22:38:15Z,1672464960,3,INDIFERENTE,"41.3850639,2.1734035",NA,NA,NA,SNE,724,ESPAÑA,ESPAÑA,8,BARCELONA,['BARCELONA'],BARCELONA,NA,NA,1.1720339,Activa,1,16005,COCINEROS,COCINEROS,NA,3,AUXILIARS DE CUINA PER SUPLèNCIES,1,#,NA,NA,NA
07,COMUNICACIÓN/CULTURA/ENTRETENIMIENTO,COMUNICACIÓN/CULTURA/ENTRETENIMIENTO,08019,Barcelona,9,CATALUÑA,"TENO CATERING PRECISA INCORPORAR PER ESCOLES DE BARCELONA PROVINCIA A MONITORS/ES PER REALITZAR SUPLèNCIES. LES TASQUES SERAN LES PRòPIES D'UN MONITOR DE MENJADOR: EDUCAR EN HàBITS HIGIèNICS I ALIMENTARIS, DINAMITZAR EL GRUP A TRAVÉS DE JOCS I ACTIVITATS, I VETLLAR PEL GRUP D'INFANTS ASSIGNAT. SOU SEGONS CONVENI. HORARI DE 12 A 15 H. APROX.<br> Datos de contacto: <br>CÓDIGO DE OFERTA: 092018033844 La inscripción a esta oferta se efectúa a través del portal Feina Activa (https://feinaactiva.gencat.cat/web/guest/home ), donde encontrará más información sobre los detalles del puesto de trabajo. Puede acceder a la oferta indicando la referencia (Referencia número:4361057) en la búsqueda avanzada de Feina Activa. Para optar a las ofertas de este portal, se precisa una inscripción previa en él.",NA,False,1,Sin estudios,NA,NA,Sin estudios,NA,False,2018-11-03T06:09:37Z,2018-11-03T00:00:00Z,2018-11-02T00:00:00Z,2018-11-03T22:38:18Z,1672464962,3,INDIFERENTE,"41.3850639,2.1734035",NA,NA,NA,SNE,724,ESPAÑA,ESPAÑA,8,BARCELONA,['BARCELONA'],BARCELONA,NA,NA,1.1720339,Activa,1,07001,ARTE/CULTURA/ESPECTÁCULOS,ARTE/CULTURA/ESPECTÁCULOS,NA,3,MONITORS/ES D'EDUCACIÓ ESPECIAL PER SUPLèNCIES BCN,1,#,NA,NA,NA
22,SALUD/DEPORTE,SALUD/DEPORTE,08074,Cubelles,9,CATALUÑA,"ES NECESSITA AUXILIAR DE GERIATRIA PER CENTRE RESIDENCIAL DE LA 3ª EDAT, SITUAT A LA POBLACIÓ DE CUBELLES (COSTA DEL GARRAF) IMPRESCINDIBLE CERTIFICAT DE PROFESSIONALITAT ATENCIÓ A PERSONES DEPENDENTS EN INSTITUCIONS SOCIALS O FP 1 O 2 / GRAU MIG BRANCA SANITàRIA. QUE SIGUIN PROPERS A LA ZONA.<br> Datos de contacto: <br>CÓDIGO DE OFERTA: 092018033828 La inscripción a esta oferta se efectúa a través del portal Feina Activa (https://feinaactiva.gencat.cat/web/guest/home ), donde encontrará más información sobre los detalles del puesto de trabajo. Puede acceder a la oferta indicando la referencia (Referencia número:4357916) en la búsqueda avanzada de Feina Activa. Para optar a las ofertas de este portal, se precisa una inscripción previa en él.",NA,False,NA,NA,NA,NA,NA,NA,False,2018-11-03T06:09:32Z,2018-11-03T00:00:00Z,2018-11-02T00:00:00Z,2018-11-03T22:38:02Z,1672464946,3,INDIFERENTE,"41.2085031,1.6727934",NA,NA,NA,SNE,724,ESPAÑA,ESPAÑA,8,BARCELONA,['BARCELONA'],BARCELONA,NA,NA,1.1720339,Activa,1,22001,MEDICINA,MEDICINA,NA,2,AUXILIAR DE GERIATRÍA,1,#,NA,NA,NA
15,FÁBRICAS/INDUSTRIA,FÁBRICAS/INDUSTRIA,08167,Polinyà,9,CATALUÑA,"TÉMPORING E.T.T PRECISA INCORPORAR OPERARIO DE ESTIRADO DE ACERO FRÍO PARA IMPORTANTE EMPRESA DEL SECTOR DEL METAL DEDICADA A PROCESOS DE TRANSFORMACIÓN DE PRODUCTOS SIDEROMETALÚRGICOS. FUNCIONES: TRANSFORMACIÓN DE LAMINADO FRÍO MEDIANTE EL PROCESO DE ESTIRADO. BUSCAMOS CANDIDATOS/AS  CON EXPERIENCIA EN TAREAS DE ESTIRADO DE ACERO EN FRÍO Y/O EN TRENES DE LAMINACIÓN EN FRÍO. SE OFRECE CONTRATO DE DOS AÑOS, INICIALMENTE 5 MESES POR ETT. HORARIO TRES TURNOS (M/T/N) ROTATIVOS.SALARIO BRUTO LA HORA 11¿78 EUROS BRUTOS. DISPONIBILIDAD INMEDIATA.<br> Datos de contacto: <br>CÓDIGO DE OFERTA: 092018033829 La inscripción a esta oferta se efectúa a través del portal Feina Activa (https://feinaactiva.gencat.cat/web/guest/home ), donde encontrará más información sobre los detalles del puesto de trabajo. Puede acceder a la oferta indicando la referencia (Referencia número:4354687) en la búsqueda avanzada de Feina Activa. Para optar a las ofertas de este portal, se precisa una inscripción previa en él.",NA,False,1,Sin estudios,NA,NA,Sin estudios,NA,False,2018-11-03T06:09:32Z,2018-11-03T00:00:00Z,2018-11-02T00:00:00Z,2018-11-03T22:38:03Z,1672464947,3,INDIFERENTE,"41.55661449999999,2.1577616",NA,NA,NA,SNE,724,ESPAÑA,ESPAÑA,8,BARCELONA,['BARCELONA'],BARCELONA,NA,NA,1.1720339,Activa,1,15001,ARTESANÍA/OFICIOS,ARTESANÍA/OFICIOS,NA,3,OPERARIO/A DE ESTIRADO DE ACERO FRIO,1,#,NA,NA,NA
